{
  "version": 1,
  "scannerVersion": "1.1.0",
  "generatedAt": "2026-06-08T13:39:06.449Z",
  "root": "/Users/vcsm/Desktop/VCSM",
  "scanDurationMs": 6492,
  "confidence": "HIGH",
  "engineGraphNodeCount": 201,
  "engineGraphEdgeCount": 192,
  "data": {
    "version": 1,
    "generatedAt": "2026-06-08T13:39:03.724Z",
    "nodes": [
      {
        "id": "engine:booking",
        "type": "EngineNode",
        "engine": "booking",
        "path": "engines/booking"
      },
      {
        "id": "controller:engines/booking/src/controller/__tests__/assertActorCanManageResource.controller.test.js",
        "type": "ControllerNode",
        "file": "engines/booking/src/controller/__tests__/assertActorCanManageResource.controller.test.js"
      },
      {
        "id": "controller:engines/booking/src/controller/__tests__/cancelBooking.controller.test.js",
        "type": "ControllerNode",
        "file": "engines/booking/src/controller/__tests__/cancelBooking.controller.test.js"
      },
      {
        "id": "controller:engines/booking/src/controller/__tests__/createBooking.controller.test.js",
        "type": "ControllerNode",
        "file": "engines/booking/src/controller/__tests__/createBooking.controller.test.js"
      },
      {
        "id": "controller:engines/booking/src/controller/assertActorCanManageLocation.controller.js",
        "type": "ControllerNode",
        "file": "engines/booking/src/controller/assertActorCanManageLocation.controller.js"
      },
      {
        "id": "controller:engines/booking/src/controller/assertActorCanManageOrganization.controller.js",
        "type": "ControllerNode",
        "file": "engines/booking/src/controller/assertActorCanManageOrganization.controller.js"
      },
      {
        "id": "controller:engines/booking/src/controller/assertActorCanManageResource.controller.js",
        "type": "ControllerNode",
        "file": "engines/booking/src/controller/assertActorCanManageResource.controller.js"
      },
      {
        "id": "controller:engines/booking/src/controller/assertActorOwnsVportActor.controller.js",
        "type": "ControllerNode",
        "file": "engines/booking/src/controller/assertActorOwnsVportActor.controller.js"
      },
      {
        "id": "controller:engines/booking/src/controller/cancelBooking.controller.js",
        "type": "ControllerNode",
        "file": "engines/booking/src/controller/cancelBooking.controller.js"
      },
      {
        "id": "controller:engines/booking/src/controller/completeBooking.controller.js",
        "type": "ControllerNode",
        "file": "engines/booking/src/controller/completeBooking.controller.js"
      },
      {
        "id": "controller:engines/booking/src/controller/confirmBooking.controller.js",
        "type": "ControllerNode",
        "file": "engines/booking/src/controller/confirmBooking.controller.js"
      },
      {
        "id": "controller:engines/booking/src/controller/createBooking.controller.js",
        "type": "ControllerNode",
        "file": "engines/booking/src/controller/createBooking.controller.js"
      },
      {
        "id": "controller:engines/booking/src/controller/createLocationResource.controller.js",
        "type": "ControllerNode",
        "file": "engines/booking/src/controller/createLocationResource.controller.js"
      },
      {
        "id": "controller:engines/booking/src/controller/createOrganizationLocationWorkspace.controller.js",
        "type": "ControllerNode",
        "file": "engines/booking/src/controller/createOrganizationLocationWorkspace.controller.js"
      },
      {
        "id": "controller:engines/booking/src/controller/createQrLink.controller.js",
        "type": "ControllerNode",
        "file": "engines/booking/src/controller/createQrLink.controller.js"
      },
      {
        "id": "controller:engines/booking/src/controller/dismissBooking.controller.js",
        "type": "ControllerNode",
        "file": "engines/booking/src/controller/dismissBooking.controller.js"
      },
      {
        "id": "controller:engines/booking/src/controller/ensureOwnerBookingResource.controller.js",
        "type": "ControllerNode",
        "file": "engines/booking/src/controller/ensureOwnerBookingResource.controller.js"
      },
      {
        "id": "controller:engines/booking/src/controller/getBookingServiceProfiles.controller.js",
        "type": "ControllerNode",
        "file": "engines/booking/src/controller/getBookingServiceProfiles.controller.js"
      },
      {
        "id": "controller:engines/booking/src/controller/getLocationAvailability.controller.js",
        "type": "ControllerNode",
        "file": "engines/booking/src/controller/getLocationAvailability.controller.js"
      },
      {
        "id": "controller:engines/booking/src/controller/getResourceAvailability.controller.js",
        "type": "ControllerNode",
        "file": "engines/booking/src/controller/getResourceAvailability.controller.js"
      },
      {
        "id": "controller:engines/booking/src/controller/listBookingHistory.controller.js",
        "type": "ControllerNode",
        "file": "engines/booking/src/controller/listBookingHistory.controller.js"
      },
      {
        "id": "controller:engines/booking/src/controller/listBookingResourcesByLocation.controller.js",
        "type": "ControllerNode",
        "file": "engines/booking/src/controller/listBookingResourcesByLocation.controller.js"
      },
      {
        "id": "controller:engines/booking/src/controller/listLocationsByOrganization.controller.js",
        "type": "ControllerNode",
        "file": "engines/booking/src/controller/listLocationsByOrganization.controller.js"
      },
      {
        "id": "controller:engines/booking/src/controller/listOrganizationsByOwnerActor.controller.js",
        "type": "ControllerNode",
        "file": "engines/booking/src/controller/listOrganizationsByOwnerActor.controller.js"
      },
      {
        "id": "controller:engines/booking/src/controller/listOwnerBookingResources.controller.js",
        "type": "ControllerNode",
        "file": "engines/booking/src/controller/listOwnerBookingResources.controller.js"
      },
      {
        "id": "controller:engines/booking/src/controller/listQrLinks.controller.js",
        "type": "ControllerNode",
        "file": "engines/booking/src/controller/listQrLinks.controller.js"
      },
      {
        "id": "controller:engines/booking/src/controller/listResourceServiceOverrides.controller.js",
        "type": "ControllerNode",
        "file": "engines/booking/src/controller/listResourceServiceOverrides.controller.js"
      },
      {
        "id": "controller:engines/booking/src/controller/markNoShow.controller.js",
        "type": "ControllerNode",
        "file": "engines/booking/src/controller/markNoShow.controller.js"
      },
      {
        "id": "controller:engines/booking/src/controller/resolveBookingContext.controller.js",
        "type": "ControllerNode",
        "file": "engines/booking/src/controller/resolveBookingContext.controller.js"
      },
      {
        "id": "controller:engines/booking/src/controller/resolveQrScan.controller.js",
        "type": "ControllerNode",
        "file": "engines/booking/src/controller/resolveQrScan.controller.js"
      },
      {
        "id": "controller:engines/booking/src/controller/setAvailabilityException.controller.js",
        "type": "ControllerNode",
        "file": "engines/booking/src/controller/setAvailabilityException.controller.js"
      },
      {
        "id": "controller:engines/booking/src/controller/setAvailabilityRule.controller.js",
        "type": "ControllerNode",
        "file": "engines/booking/src/controller/setAvailabilityRule.controller.js"
      },
      {
        "id": "controller:engines/booking/src/controller/setResourceSlotDuration.controller.js",
        "type": "ControllerNode",
        "file": "engines/booking/src/controller/setResourceSlotDuration.controller.js"
      },
      {
        "id": "controller:engines/booking/src/controller/upsertResourceServiceOverride.controller.js",
        "type": "ControllerNode",
        "file": "engines/booking/src/controller/upsertResourceServiceOverride.controller.js"
      },
      {
        "id": "dal:engines/booking/src/dal/actor.read.dal.js",
        "type": "DALNode",
        "file": "engines/booking/src/dal/actor.read.dal.js"
      },
      {
        "id": "dal:engines/booking/src/dal/availability.read.dal.js",
        "type": "DALNode",
        "file": "engines/booking/src/dal/availability.read.dal.js"
      },
      {
        "id": "dal:engines/booking/src/dal/availability.write.dal.js",
        "type": "DALNode",
        "file": "engines/booking/src/dal/availability.write.dal.js"
      },
      {
        "id": "dal:engines/booking/src/dal/booking.read.dal.js",
        "type": "DALNode",
        "file": "engines/booking/src/dal/booking.read.dal.js"
      },
      {
        "id": "dal:engines/booking/src/dal/booking.write.dal.js",
        "type": "DALNode",
        "file": "engines/booking/src/dal/booking.write.dal.js"
      },
      {
        "id": "dal:engines/booking/src/dal/location.read.dal.js",
        "type": "DALNode",
        "file": "engines/booking/src/dal/location.read.dal.js"
      },
      {
        "id": "dal:engines/booking/src/dal/location.write.dal.js",
        "type": "DALNode",
        "file": "engines/booking/src/dal/location.write.dal.js"
      },
      {
        "id": "dal:engines/booking/src/dal/organization.read.dal.js",
        "type": "DALNode",
        "file": "engines/booking/src/dal/organization.read.dal.js"
      },
      {
        "id": "dal:engines/booking/src/dal/organization.write.dal.js",
        "type": "DALNode",
        "file": "engines/booking/src/dal/organization.write.dal.js"
      },
      {
        "id": "dal:engines/booking/src/dal/qrLink.read.dal.js",
        "type": "DALNode",
        "file": "engines/booking/src/dal/qrLink.read.dal.js"
      },
      {